{
  "format": "harness-map-v1",
  "title": "Reading platform refresh",
  "work": "refresh",
  "source": {
    "repository": "shelf",
    "base": "1405df66cbe219b0bf6355bc3d60361a8376b6b4",
    "head": "26b56c1bdfb048c3e46419fde332bab76deb2cd3",
    "baseRef": "main",
    "headRef": "feat/refresh"
  },
  "layers": [
    {
      "id": "screens",
      "title": "Screens"
    },
    {
      "id": "api",
      "title": "API routes"
    },
    {
      "id": "domain",
      "title": "Domain"
    },
    {
      "id": "storage",
      "title": "Storage and services"
    }
  ],
  "groups": [
    {
      "id": "catalog",
      "title": "Catalog",
      "summary": "Book records and search."
    },
    {
      "id": "lists",
      "title": "Lists",
      "summary": "Reading lists and their items."
    },
    {
      "id": "sharing",
      "title": "Sharing",
      "summary": "Invitations and reader access."
    },
    {
      "id": "accounts",
      "title": "Accounts",
      "summary": "Sign-in and profiles."
    },
    {
      "id": "notify",
      "title": "Notifications",
      "summary": "Email and in-app notices."
    },
    {
      "id": "billing",
      "title": "Billing",
      "summary": "Plans and invoices."
    }
  ],
  "cards": [
    {
      "id": "catalog-page",
      "layer": "screens",
      "group": "catalog",
      "title": "Catalog page",
      "summary": "Page of the catalog module.",
      "files": ["src/catalog/page.ts"],
      "attention": [],
      "flows": []
    },
    {
      "id": "catalog-form",
      "layer": "screens",
      "group": "catalog",
      "title": "Catalog form",
      "summary": "Form of the catalog module.",
      "files": ["src/catalog/form.ts"],
      "attention": [],
      "flows": []
    },
    {
      "id": "catalog-read",
      "layer": "api",
      "group": "catalog",
      "title": "Catalog read endpoint",
      "summary": "Read endpoint of the catalog module.",
      "files": ["src/catalog/read.ts"],
      "attention": [],
      "flows": []
    },
    {
      "id": "catalog-write",
      "layer": "api",
      "group": "catalog",
      "title": "Catalog write endpoint",
      "summary": "Write endpoint of the catalog module.",
      "files": ["src/catalog/write.ts"],
      "attention": [],
      "flows": []
    },
    {
      "id": "catalog-rules",
      "layer": "domain",
      "group": "catalog",
      "title": "Catalog rules",
      "summary": "Rules of the catalog module.",
      "files": ["src/catalog/rules.ts"],
      "attention": [],
      "flows": []
    },
    {
      "id": "catalog-service",
      "layer": "domain",
      "group": "catalog",
      "title": "Catalog service",
      "summary": "Service of the catalog module.",
      "files": ["src/catalog/service.ts"],
      "attention": [],
      "flows": []
    },
    {
      "id": "catalog-repo",
      "layer": "storage",
      "group": "catalog",
      "title": "Catalog repository",
      "summary": "Repository of the catalog module.",
      "files": ["src/catalog/repo.ts"],
      "attention": [],
      "flows": []
    },
    {
      "id": "catalog-jobs",
      "layer": "storage",
      "group": "catalog",
      "title": "Catalog background jobs",
      "summary": "Background jobs of the catalog module.",
      "files": ["src/catalog/jobs.ts"],
      "attention": [],
      "flows": []
    },
    {
      "id": "lists-page",
      "layer": "screens",
      "group": "lists",
      "title": "Lists page",
      "summary": "Page of the lists module.",
      "files": ["src/lists/page.ts"],
      "attention": [],
      "flows": ["fl-share"]
    },
    {
      "id": "lists-form",
      "layer": "screens",
      "group": "lists",
      "title": "Lists form",
      "summary": "Form of the lists module.",
      "files": ["src/lists/form.ts"],
      "attention": [],
      "flows": []
    },
    {
      "id": "lists-read",
      "layer": "api",
      "group": "lists",
      "title": "Lists read endpoint",
      "summary": "Read endpoint of the lists module.",
      "files": ["src/lists/read.ts"],
      "attention": [],
      "flows": []
    },
    {
      "id": "lists-write",
      "layer": "api",
      "group": "lists",
      "title": "Lists write endpoint",
      "summary": "Write endpoint of the lists module.",
      "files": ["src/lists/write.ts"],
      "attention": [],
      "flows": []
    },
    {
      "id": "lists-rules",
      "layer": "domain",
      "group": "lists",
      "title": "Lists rules",
      "summary": "Rules of the lists module.",
      "files": ["src/lists/rules.ts"],
      "attention": ["ap-access"],
      "flows": ["fl-share"]
    },
    {
      "id": "lists-service",
      "layer": "domain",
      "group": "lists",
      "title": "Lists service",
      "summary": "Service of the lists module.",
      "files": ["src/lists/service.ts"],
      "attention": [],
      "flows": []
    },
    {
      "id": "lists-repo",
      "layer": "storage",
      "group": "lists",
      "title": "Lists repository",
      "summary": "Repository of the lists module.",
      "files": ["src/lists/repo.ts"],
      "attention": [],
      "flows": []
    },
    {
      "id": "lists-jobs",
      "layer": "storage",
      "group": "lists",
      "title": "Lists background jobs",
      "summary": "Background jobs of the lists module.",
      "files": ["src/lists/jobs.ts"],
      "attention": [],
      "flows": []
    },
    {
      "id": "sharing-page",
      "layer": "screens",
      "group": "sharing",
      "title": "Sharing page",
      "summary": "Page of the sharing module.",
      "files": ["src/sharing/page.ts"],
      "attention": [],
      "flows": []
    },
    {
      "id": "sharing-form",
      "layer": "screens",
      "group": "sharing",
      "title": "Sharing form",
      "summary": "Form of the sharing module.",
      "files": ["src/sharing/form.ts"],
      "attention": [],
      "flows": []
    },
    {
      "id": "sharing-read",
      "layer": "api",
      "group": "sharing",
      "title": "Sharing read endpoint",
      "summary": "Read endpoint of the sharing module.",
      "files": ["src/sharing/read.ts"],
      "attention": [],
      "flows": []
    },
    {
      "id": "sharing-write",
      "layer": "api",
      "group": "sharing",
      "title": "Sharing write endpoint",
      "summary": "Write endpoint of the sharing module.",
      "files": ["src/sharing/write.ts"],
      "attention": [],
      "flows": []
    },
    {
      "id": "sharing-rules",
      "layer": "domain",
      "group": "sharing",
      "title": "Sharing rules",
      "summary": "Rules of the sharing module.",
      "files": ["src/sharing/rules.ts"],
      "attention": ["ap-access"],
      "flows": []
    },
    {
      "id": "sharing-service",
      "layer": "domain",
      "group": "sharing",
      "title": "Sharing service",
      "summary": "Service of the sharing module.",
      "files": ["src/sharing/service.ts"],
      "attention": [],
      "flows": ["fl-share"]
    },
    {
      "id": "sharing-repo",
      "layer": "storage",
      "group": "sharing",
      "title": "Sharing repository",
      "summary": "Repository of the sharing module.",
      "files": ["src/sharing/repo.ts"],
      "attention": [],
      "flows": []
    },
    {
      "id": "sharing-jobs",
      "layer": "storage",
      "group": "sharing",
      "title": "Sharing background jobs",
      "summary": "Background jobs of the sharing module.",
      "files": ["src/sharing/jobs.ts"],
      "attention": [],
      "flows": []
    },
    {
      "id": "accounts-page",
      "layer": "screens",
      "group": "accounts",
      "title": "Accounts page",
      "summary": "Page of the accounts module.",
      "files": ["src/accounts/page.ts"],
      "attention": [],
      "flows": []
    },
    {
      "id": "accounts-form",
      "layer": "screens",
      "group": "accounts",
      "title": "Accounts form",
      "summary": "Form of the accounts module.",
      "files": ["src/accounts/form.ts"],
      "attention": [],
      "flows": []
    },
    {
      "id": "accounts-read",
      "layer": "api",
      "group": "accounts",
      "title": "Accounts read endpoint",
      "summary": "Read endpoint of the accounts module.",
      "files": ["src/accounts/read.ts"],
      "attention": [],
      "flows": []
    },
    {
      "id": "accounts-write",
      "layer": "api",
      "group": "accounts",
      "title": "Accounts write endpoint",
      "summary": "Write endpoint of the accounts module.",
      "files": ["src/accounts/write.ts"],
      "attention": [],
      "flows": []
    },
    {
      "id": "accounts-rules",
      "layer": "domain",
      "group": "accounts",
      "title": "Accounts rules",
      "summary": "Rules of the accounts module.",
      "files": ["src/accounts/rules.ts"],
      "attention": [],
      "flows": []
    },
    {
      "id": "accounts-service",
      "layer": "domain",
      "group": "accounts",
      "title": "Accounts service",
      "summary": "Service of the accounts module.",
      "files": ["src/accounts/service.ts"],
      "attention": [],
      "flows": []
    },
    {
      "id": "accounts-repo",
      "layer": "storage",
      "group": "accounts",
      "title": "Accounts repository",
      "summary": "Repository of the accounts module.",
      "files": ["src/accounts/repo.ts"],
      "attention": ["ap-access"],
      "flows": []
    },
    {
      "id": "accounts-jobs",
      "layer": "storage",
      "group": "accounts",
      "title": "Accounts background jobs",
      "summary": "Background jobs of the accounts module.",
      "files": ["src/accounts/jobs.ts"],
      "attention": [],
      "flows": []
    },
    {
      "id": "notify-page",
      "layer": "screens",
      "group": "notify",
      "title": "Notifications page",
      "summary": "Page of the notifications module.",
      "files": ["src/notify/page.ts"],
      "attention": [],
      "flows": []
    },
    {
      "id": "notify-form",